{
  "schemaVersion": 2,
  "metadata": {
    "name": "ReleaseSeal evidence database",
    "databaseVersion": "2026.08.03.1",
    "releaseDate": "2026-08-03",
    "notes": "Trusted entries are allowlist evidence only; compromised entries take precedence."
  },
  "trustedCertificates": [
    {
      "type": "root-sha256",
      "hash": "43858ea069e6e922d8eab1062d4c16631a1c6ae248efd5511e710d8e8209fdc7",
      "label": "Dokdo, Beautiful Island",
      "subject": "/CN=Dokdo, Beautiful Island/O=Dokdo, Beautiful Island/OU=For Educational Purposes Only/ST=Beautiful Island/C=DE/L=Dokdo",
      "expires": "2035-09-20T02:00:00Z",
      "notes": "Self-signed release-group certificate observed on the app bundle in the cited sample.",
      "source": "Araxis Merge Professional 2026.0 [Dokdo].dmg"
    },
    {
      "type": "root-sha256",
      "hash": "f1516a983975b6c0847c59fa12291b1f16d3a10718d742a3904949b98a2f8ccd",
      "label": "Antibiotics",
      "subject": "/CN=Antibiotics/O=MSJ/C=CN",
      "expires": "2034-06-13T13:08:07Z",
      "notes": "Self-signed release-group certificate observed on both the DMG and app bundle in the cited sample.",
      "source": "Vibe Island 1.0.34 [atb].dmg"
    },
    {
      "type": "root-sha256",
      "hash": "69a62e7cd7fc8da856bf1717ae04992fa3be06df732318583f12dffcd61033eb",
      "label": "https://macked.app",
      "subject": "/O=MacKed/OU=https://macked.app/CN=https://macked.app/emailAddress=codesign@macked.app",
      "expires": "2099-12-31T23:59:59Z",
      "notes": "Self-signed release-group certificate observed on the app bundle; the embedded common name is https://macked.app.",
      "source": "Vehla 6.3 [MacKed].dmg"
    },
    {
      "type": "leaf-sha256",
      "hash": "861b660daec7fb0246375add56083fab34d6d06f27d028e73268c17d2c39ce37",
      "label": "Developer ID Application: TEAM HCiSO (76TX64X7HC)",
      "subject": "/C=US/O=TEAM HCiSO/OU=76TX64X7HC/CN=Developer ID Application: TEAM HCiSO (76TX64X7HC)",
      "expires": "2030-09-01T23:59:59Z",
      "notes": "Apple-issued Developer ID Application certificate used by TEAM HCiSO on the app bundle; identity is matched only by its leaf fingerprint.",
      "source": "UltraEdit_25.0.0.11_[HCiSO].dmg"
    },
    {
      "type": "root-sha256",
      "hash": "cdc5c06d2c4e3059beeea8bf37636074d5a397d0b92d20e6d84b4e001ba32971",
      "label": "TNT",
      "subject": "/CN=TNT/O=TNT - why join the navy if you can be a pirate/C=RU/emailAddress=tnt4mac@tuta.io",
      "expires": "2027-06-09T15:37:11Z",
      "notes": "Self-signed release-group certificate observed on the app bundle in the cited sample.",
      "source": "Qbserve_1.91_[TNT].dmg"
    },
    {
      "type": "root-sha256",
      "hash": "23ca38d7ef58a70e8c7991df681a03cf77d8ffb607351b3cc55a21c21d0fb786",
      "label": "TNT",
      "subject": "/CN=TNT/O=TNT - why join the navy if you can be a pirate/OU=TNT2019STW/C=RU/emailAddress=tnt4mac@tuta.io",
      "expires": "2035-05-09T08:37:13Z",
      "notes": "Self-signed TNT certificate observed on the valid app-bundle seal in the cited sample. The outer DMG is unsigned.",
      "source": "Typora_1.10.6_[TNT].dmg"
    },
    {
      "type": "root-sha256",
      "hash": "aa7d3843795bed55acdd443cf7648a275c02ee615d77848efb0d45a467edc073",
      "label": "TEAM EDiSO",
      "subject": "/CN=TEAM EDiSO/O=TEAM EDiSO/C=AU/emailAddress=please@fuck.off",
      "expires": "2035-06-21T23:50:08Z",
      "notes": "Self-signed release-group certificate observed on the app bundle. Provenance confirmed from a direct EDiSO release.",
      "source": "OmniOutliner 6.2 [EDiSO].dmg"
    },
    {
      "type": "root-sha256",
      "hash": "90f605071bf3418ae709f1ebd03d98739689d476309b18c42c9462d81fe47def",
      "label": "aqzs",
      "subject": "/CN=aqzs/O=aqzs/ST=France/C=FR/L=Paris/emailAddress=aqzs@msj.com",
      "expires": "2045-06-21T16:38:45Z",
      "notes": "Self-signed aqzs certificate observed on the valid app-bundle seal in the cited sample. The outer DMG is unsigned.",
      "source": "Paragraphic 1.2.4 [aqzs] [U2B].dmg"
    },
    {
      "type": "root-sha256",
      "hash": "b04e6205e1d78eb9c4cb87a6651e50bb3110f6f50110c61fdefb884e722fde7c",
      "label": "LOVE",
      "subject": "/CN=LOVE",
      "expires": "2222-02-02T22:22:22Z",
      "notes": "Self-signed LOVE certificate observed on the valid app-bundle seal in the cited verified release. The outer DMG is unsigned.",
      "source": "Vibe Island 1.0.41 [LOVE].dmg"
    },
    {
      "type": "root-sha256",
      "hash": "5b3320483fc794488cc7caa4c3b6eca9178b7350a20fb38190b106742206b333",
      "label": "SEAL TEAM WORLDWIDE",
      "subject": "/CN=SEAL TEAM WORLDWIDE/O=SEAL TEAM WORLDWIDE/C=AU",
      "expires": "2038-04-20T19:48:15Z",
      "notes": "Self-signed ReleaseSeal project identity validated on both the test app bundle and its signed outer DMG.",
      "source": "ReleaseSeal-SEAL-TEAM-WORLDWIDE-Test.dmg"
    },
    {
      "type": "leaf-sha256",
      "hash": "e82b38dcf5e5cd9e1f0808c91ffcf8706f032cf3bed0008009b996d418ae4e7d",
      "label": "Developer ID Application: Ableton AG (MWR434WD94)",
      "subject": "/UID=MWR434WD94/CN=Developer ID Application: Ableton AG (MWR434WD94)/OU=MWR434WD94/O=Ableton AG/C=DE",
      "expires": "2027-01-28T11:34:32Z",
      "notes": "Apple-issued Developer ID Application certificate observed on an official Ableton trial DMG downloaded from Ableton.",
      "source": "ableton_live_trial_12.4.3_universal-og.dmg"
    },
    {
      "type": "leaf-sha256",
      "hash": "645d86d2df769ed704cfb1fa1b387f7869dc8712ab4e0fbcebbc2964d3e9a948",
      "label": "Developer ID Installer: Microsoft Corporation (UBF8T346G9)",
      "subject": "/UID=UBF8T346G9/CN=Developer ID Installer: Microsoft Corporation (UBF8T346G9)/OU=UBF8T346G9/O=Microsoft Corporation/C=US",
      "expires": "2027-02-01T22:12:15Z",
      "notes": "Apple-issued Developer ID Installer certificate observed on an official Microsoft 365 and Office installer package.",
      "source": "Microsoft_365_and_Office_16.111.26071325_Installer.pkg"
    },
    {
      "type": "leaf-sha256",
      "hash": "7ccff00abba59a11328f439df95f0c37c2d4cd511370d488bd1ae4a35bc10e68",
      "label": "Developer ID Application: Canva Pty Ltd (5HD2ARTBFS)",
      "subject": "/UID=5HD2ARTBFS/CN=Developer ID Application: Canva Pty Ltd (5HD2ARTBFS)/OU=5HD2ARTBFS/O=Canva Pty Ltd/C=US",
      "expires": "2027-02-01T22:12:15Z",
      "notes": "Apple-issued Developer ID Application certificate observed on the app bundle inside the cited official Canva DMG. The outer DMG is unsigned.",
      "source": "Affinity_3.2.2.4557_20260617_080328.dmg"
    },
    {
      "type": "leaf-sha256",
      "hash": "3b20d329dcdc7bc4164115403b1102cf032c8a9b075eb22860f9e88e1c28f9a9",
      "label": "Developer ID Application: Adobe Systems, Inc. (JQ525L2MZD)",
      "subject": "/UID=JQ525L2MZD/CN=Developer ID Application: Adobe Systems, Inc. (JQ525L2MZD)/OU=JQ525L2MZD/O=Adobe Systems, Inc./C=US",
      "expires": "2022-02-11T00:05:48Z",
      "notes": "Historical Apple-issued Developer ID Application certificate observed on the signed official Adobe Creative Cloud DMG. Its signature includes a trusted timestamp from before certificate expiration.",
      "source": "ACCCx4_9_0_504.dmg"
    },
    {
      "type": "leaf-sha256",
      "hash": "9ff4333283ec0a959965925f1ea235a6fe438ded8feab28d238d8a564195a0a4",
      "label": "Developer ID Application: Adobe Inc. (JQ525L2MZD)",
      "subject": "/UID=JQ525L2MZD/CN=Developer ID Application: Adobe Inc. (JQ525L2MZD)/OU=JQ525L2MZD/O=Adobe Inc./C=US",
      "expires": "2027-02-01T22:12:15Z",
      "notes": "Apple-issued Developer ID Application certificate observed on official Adobe Creative Cloud and Acrobat DMGs.",
      "source": "ACCCx6_10_0_252_3.dmg"
    },
    {
      "type": "leaf-sha256",
      "hash": "979a81be0715ba87990eaddcae97a79808198a1ede0f4a420dce389680a1cebf",
      "label": "Developer ID Installer: Adobe Inc. (JQ525L2MZD)",
      "subject": "/UID=JQ525L2MZD/CN=Developer ID Installer: Adobe Inc. (JQ525L2MZD)/OU=JQ525L2MZD/O=Adobe Inc./C=US",
      "expires": "2027-02-01T22:12:15Z",
      "notes": "Apple-issued Developer ID Installer certificate observed on the notarized Acrobat installer package inside the cited official Adobe DMG.",
      "source": "Acrobat DC SCA Installer.pkg"
    },
    {
      "type": "leaf-sha256",
      "hash": "c69b4573b887abcaeb29e74d8ef3a49ad3ad8b683c3dc22ba7502b37a6878069",
      "label": "Developer ID Application: AgileBits Inc. (2BUA8C4S2C)",
      "subject": "/UID=2BUA8C4S2C/CN=Developer ID Application: AgileBits Inc. (2BUA8C4S2C)/OU=2BUA8C4S2C/O=AgileBits Inc./C=CA",
      "expires": "2029-05-02T14:25:42Z",
      "notes": "Apple-issued Developer ID Application certificate observed on the 1Password app bundle in the cited sample.",
      "source": "1Password.zip"
    },
    {
      "type": "leaf-sha256",
      "hash": "80871fc96487042b473ff3e7340af22d12ab6507cb9690f24d1203a3646f968e",
      "label": "Developer ID Application: Anthropic PBC (Q6L2SF6YDW)",
      "subject": "/UID=Q6L2SF6YDW/CN=Developer ID Application: Anthropic PBC (Q6L2SF6YDW)/OU=Q6L2SF6YDW/O=Anthropic PBC/C=US",
      "expires": "2031-05-30T16:28:47Z",
      "notes": "Apple-issued Developer ID Application certificate observed on the cited official Claude DMG.",
      "source": "Claude.dmg"
    },
    {
      "type": "leaf-sha256",
      "hash": "d84db96af8c2e60ac4c851a21ec460f6f84e0235beb17d24a78712b9b021ed57",
      "label": "Software Signing",
      "subject": "/C=US/O=Apple Inc./OU=Apple Software/CN=Software Signing",
      "expires": "2026-10-24T17:39:41Z",
      "notes": "Apple software-signing certificate observed on Safari.app in the cited locally generated candidate record.",
      "source": "Safari.app"
    },
    {
      "type": "leaf-sha256",
      "hash": "2bb12497bb2dcc3eed41bc6b42d267f4aecc596f68fb674c016d68f7edd42a08",